{
 "classes": {
  "CP": {
   "N": null,
   "agent_file_sha256": null,
   "caps": null,
   "certainty": null,
   "cost_ratio": null,
   "effect": null,
   "loo_view": null,
   "member_model_id": null,
   "member_type": null,
   "pool": null,
   "reducer": null,
   "rounds": null,
   "status": "not_run",
   "t": null,
   "tau": null,
   "usd_per_mtok": null,
   "view": null
  },
  "CR": {
   "N": null,
   "agent_file_sha256": null,
   "caps": null,
   "certainty": null,
   "cost_ratio": null,
   "effect": null,
   "loo_view": null,
   "member_model_id": null,
   "member_type": null,
   "pool": null,
   "reducer": null,
   "rounds": null,
   "status": "not_run",
   "t": null,
   "tau": null,
   "usd_per_mtok": null,
   "view": null
  },
  "DS": {
   "N": null,
   "agent_file_sha256": null,
   "caps": null,
   "certainty": null,
   "cost_ratio": null,
   "effect": null,
   "loo_view": null,
   "member_model_id": null,
   "member_type": null,
   "pool": null,
   "reducer": null,
   "rounds": null,
   "status": "not_run",
   "t": null,
   "tau": null,
   "usd_per_mtok": null,
   "view": null
  },
  "ES": {
   "N": null,
   "agent_file_sha256": null,
   "caps": null,
   "certainty": null,
   "cost_ratio": null,
   "effect": null,
   "loo_view": null,
   "member_model_id": null,
   "member_type": null,
   "pool": null,
   "reducer": null,
   "rounds": null,
   "status": "not_run",
   "t": null,
   "tau": null,
   "usd_per_mtok": null,
   "view": null
  },
  "OE": {
   "N": null,
   "agent_file_sha256": null,
   "caps": null,
   "certainty": null,
   "cost_ratio": null,
   "effect": null,
   "loo_view": null,
   "member_model_id": null,
   "member_type": null,
   "pool": null,
   "reducer": null,
   "rounds": null,
   "status": "not_run",
   "t": null,
   "tau": null,
   "usd_per_mtok": null,
   "view": null
  },
  "PF": {
   "N": null,
   "agent_file_sha256": null,
   "caps": null,
   "certainty": null,
   "cost_ratio": null,
   "effect": null,
   "loo_view": null,
   "member_model_id": null,
   "member_type": null,
   "pool": null,
   "reducer": null,
   "rounds": null,
   "status": "not_run",
   "t": null,
   "tau": null,
   "usd_per_mtok": null,
   "view": null
  },
  "RS": {
   "N": null,
   "agent_file_sha256": null,
   "caps": null,
   "certainty": null,
   "cost_ratio": null,
   "effect": null,
   "loo_view": null,
   "member_model_id": null,
   "member_type": null,
   "pool": null,
   "reducer": null,
   "rounds": null,
   "status": "not_run",
   "t": null,
   "tau": null,
   "usd_per_mtok": null,
   "view": null
  }
 },
 "created_utc": "2026-10-06T17:08:39Z",
 "provenance": {
  "amendments": null,
  "claude_code_version": null,
  "config_sha256": null,
  "created_utc": "2026-10-06T17:08:39Z",
  "grader_kappa": null,
  "harness_commit": null,
  "model_ids": null,
  "note": "no calibration exists: every class not_run (RUNTIME_EQUILIBRIUM.md §7.6)",
  "pool_sha256": null,
  "report": null,
  "route2": null,
  "sha256": null,
  "stack_commit": null,
  "stage_ledgers": null,
  "stages": []
 },
 "schema": "eqparams.v1",
 "version": 0
}
